{
  "$schema": "https://json-schema.org/draft/2020-12/schema",
  "$id": "https://destruktion.local/schemas/research_plan.schema.json",
  "title": "Destruktion preregistered research plan",
  "type": "object",
  "additionalProperties": false,
  "required": ["plan_version", "preregistration_id", "title", "created_at", "unit_of_analysis", "codebook", "sampling", "blinding", "metrics", "negative_tests", "kill_criteria", "gates", "deviation_policy"],
  "properties": {
    "plan_version": {"const": "DAE-RESEARCH-PLAN-1.0"},
    "preregistration_id": {"type": "string", "pattern": "^[A-Za-z0-9][A-Za-z0-9._:-]{2,127}$"},
    "title": {"type": "string", "minLength": 3},
    "created_at": {"type": "string", "pattern": "^\\d{4}-\\d{2}-\\d{2}T\\d{2}:\\d{2}:\\d{2}(?:\\.\\d{1,3})?Z$"},
    "hypothesis": {"type": "string"},
    "counter_hypothesis": {"type": "string"},
    "unit_of_analysis": {
      "type": "object",
      "additionalProperties": false,
      "required": ["description", "context_rule", "stable_id_rule"],
      "properties": {
        "description": {"type": "string", "minLength": 1},
        "context_rule": {"type": "string", "minLength": 1},
        "stable_id_rule": {"type": "string", "minLength": 1}
      }
    },
    "codebook": {
      "type": "array",
      "minItems": 1,
      "items": {
        "type": "object",
        "additionalProperties": false,
        "required": ["code", "question", "positive_criterion", "boundary"],
        "properties": {
          "code": {"type": "string", "pattern": "^[A-Z][A-Z0-9_-]{1,31}$"},
          "question": {"type": "string", "minLength": 1},
          "positive_criterion": {"type": "string", "minLength": 1},
          "boundary": {"type": "string", "minLength": 1}
        }
      }
    },
    "sampling": {
      "type": "object",
      "additionalProperties": false,
      "required": ["population", "strata", "quotas", "seed", "deduplication"],
      "properties": {
        "population": {"type": "string", "minLength": 1},
        "strata": {"type": "array", "minItems": 1, "items": {"type": "string", "minLength": 1}, "uniqueItems": true},
        "quotas": {"type": "object", "minProperties": 1, "additionalProperties": {"type": "integer", "minimum": 0}},
        "seed": {"type": "string", "minLength": 1},
        "deduplication": {"type": "string", "minLength": 1}
      }
    },
    "blinding": {
      "type": "array",
      "minItems": 1,
      "items": {
        "type": "object",
        "additionalProperties": false,
        "required": ["phase", "visible", "hidden", "risk_tested"],
        "properties": {
          "phase": {"type": "string", "minLength": 1},
          "visible": {"type": "array", "items": {"type": "string", "minLength": 1}},
          "hidden": {"type": "array", "items": {"type": "string", "minLength": 1}},
          "risk_tested": {"type": "string", "minLength": 1}
        }
      }
    },
    "metrics": {
      "type": "array",
      "minItems": 1,
      "items": {
        "type": "object",
        "additionalProperties": false,
        "required": ["id", "measure", "threshold", "fail_action"],
        "properties": {
          "id": {"type": "string", "pattern": "^[A-Z0-9][A-Z0-9._-]{1,63}$"},
          "measure": {"type": "string", "minLength": 1},
          "threshold": {"type": "string", "minLength": 1},
          "fail_action": {"type": "string", "minLength": 1}
        }
      }
    },
    "negative_tests": {
      "type": "array",
      "minItems": 1,
      "items": {
        "type": "object",
        "additionalProperties": false,
        "required": ["id", "operation", "stability_criterion", "fail_action"],
        "properties": {
          "id": {"type": "string", "pattern": "^[A-Z0-9][A-Z0-9._-]{1,63}$"},
          "operation": {"type": "string", "minLength": 1},
          "stability_criterion": {"type": "string", "minLength": 1},
          "fail_action": {"type": "string", "minLength": 1}
        }
      }
    },
    "kill_criteria": {
      "type": "array",
      "minItems": 1,
      "items": {
        "type": "object",
        "additionalProperties": false,
        "required": ["id", "condition", "action"],
        "properties": {
          "id": {"type": "string", "pattern": "^[A-Z0-9][A-Z0-9._-]{1,63}$"},
          "condition": {"type": "string", "minLength": 1},
          "action": {"type": "string", "minLength": 1}
        }
      }
    },
    "gates": {
      "type": "object",
      "additionalProperties": false,
      "required": ["data", "authorization", "license", "coders"],
      "properties": {
        "data": {"$ref": "#/$defs/gate"},
        "authorization": {"$ref": "#/$defs/gate"},
        "license": {"$ref": "#/$defs/gate"},
        "coders": {"$ref": "#/$defs/gate"}
      }
    },
    "deviation_policy": {"type": "string", "minLength": 1},
    "source_refs": {"type": "array", "items": {"type": "string", "minLength": 1}, "uniqueItems": true}
  },
  "$defs": {
    "gate": {
      "type": "object",
      "additionalProperties": false,
      "required": ["status", "evidence_refs", "block_if_not_passed"],
      "properties": {
        "status": {"enum": ["PASS", "BLOCKED", "UNKNOWN"]},
        "evidence_refs": {"type": "array", "items": {"type": "string", "minLength": 1}, "uniqueItems": true},
        "block_if_not_passed": {"const": true},
        "note": {"type": "string"}
      }
    }
  }
}
